{
  "object_type": "registry_entry",
  "schema_version": "v1",
  "registry_entry_id": "reg_synthetic_demo_0001",
  "receipt_id": "vr_synthetic_demo_0001",
  "issuer_id": "issuer_synthetic_demo",
  "issuer_key_id": "demo-key-2",
  "asset_type": "fund_nav",
  "workflow": "fund_nav_update",
  "subject_ref_hash": "sha256:aaaaaaaaaaaaaaaaaaaaaaaaaaaaaaaaaaaaaaaaaaaaaaaaaaaaaaaaaaaaaaaa",
  "manifest_hash": "sha256:bbbbbbbbbbbbbbbbbbbbbbbbbbbbbbbbbbbbbbbbbbbbbbbbbbbbbbbbbbbbbbbb",
  "receipt_hash": "sha256:cccccccccccccccccccccccccccccccccccccccccccccccccccccccccccccccc",
  "policy_id": "loquitur.fund_nav.v1",
  "policy_version": "1.0.0",
  "reason_code_catalog_version": "loquitur.reason_codes.v1",
  "verdict": "REVIEW",
  "reason_codes": [
    "CONFLICTING_EVIDENCE_DETECTED"
  ],
  "issued_at": "2026-04-29T12:00:00Z",
  "effective_at": "2026-04-29T00:00:00Z",
  "anchored_at": null,
  "privacy_classification": "public_commitment",
  "disclosure_profile": "issuer_controlled_bundle",
  "signature": null,
  "anchor": null
}
